text,paragraph
citra ṛkṣa praveśe hi caturdaśyāṃ niśāṃtare |<br/>sarastīre japenmaṃtraṃ vicitrāyā viśeṣataḥ ||,882
ayutaṃ kamalākṣaiśca homaṃ kuryād daśāṃśataḥ |<br/>tato devī samāyāti vicitravasanāṃcalā ||,883
dadāti maṃtriṇe tasmai vicitravasanāṃcalaṃ |<br/>tadaṃcalaṃ tu saṃpūjya rātrau saṃsthāpayed gṛhe ||,884
tadgṛhaṃ pūryate vastrai rājamaṃdiragairapi ||,885
dhyānaṃ ||,886
citracailāṃcala prītiṃ citramālyānulepanāṃ |<br/>vicitrā bharaṇāṃ devīṃ vicitrāṃ bhajamānase ||,887
maṃtraḥ || ,888
vicitre citracailāṃcala dehi vāsaḥ pūraya 2 pūṃ svāhā || 32 || ,889
asyāpi pratirūpaṃ hi maṃtraḥ paṃcāla bhāṣayā |<br/>tathaiva sa tu japtavyo maṃtrastatra niśāṃtare ||,890
tato devī prasannā sā dadāti hi karaṃḍakaṃ |<br/>tasya pūjā vidhānena jāyate sarva ṛddhimān ||,891
na kadācid daridraṃ hi sanaraścānu bhūyati ||,892
maṃtraḥ || ,893
vicitrīttaṃ vicitra khela 2 ṇī prasanna śrīguru āṇasiddhāvī śrīṃ svāhā || 36 || <br/>iti vicitrāvidhiḥ ||,894
atha vidhipūrvakāvidhiḥ ||,895
kṛṣṇātīre mahātīrtha paṃcagaṃgā samāgame |<br/>māghe māsi dvitīyāyāṃ kṛṣṇapakṣe niśāṃtare ||,896
kṛtvā tṛṇa kusūlaṃ hi nikṣipeddhi janāṃtare |<br/>kṛtvā sāyāṃtakaṃ karmaṃ kusūlaṃ pūjayet tataḥ ||,897
tato devīṃ smaranmaṃtrī kusūlāṃtarviśeddhruvaṃ |<br/>tatra vaddhāsano yogī śītavādhāmupekṣya hi ||,898
59a),899
japet paṃca sahasraṃ hi devatāṃ vidhipūrvakāṃ |<br/>tatastasmin kuśūlāṃta vidhinā sahasaṃyutāṃ ||,900
paṃcavaktrāṃ trinetrāṃ hi paśyedaṣṭa bhujāṃ śivāṃ |<br/>tataḥ sā devatā tasmai dadāti hi kamaṃḍaluṃ ||,901
jalapūrṇaṃ tatastatstha jalenā secayeddhiyaṃ |<br/>sanarastatkṣaṇādeva saptajanma samudbhavāṃ ||,902
jātiṃ vadati tatkālaṃ tat tatkarma karoti ca |<br/>patitapālana ityetannāma tasya bhavediha ||,903
dhyānaṃ ||,904
amalanīraparīta kamaṇḍaluṃ svakarairdadhatī jagadaṃvikāṃ |<br/>kanakakuṃḍalamaṃḍita gaṃḍaruka sucirāṃbhaje vidhipūrvakāṃ ||,905
maṃtraḥ || ,906
vidhipūrvake ācakranakhare hrīṃ srīṃ svāhā || ,907
asyāpi pratimaṃtrosti samyakkerala bhāṣayā |<br/>tena sadyo hi sā devī jalāṭha kaṣṭiṃ dadāti hi ||,908
sa tu mādye sitāṣṭamyāṃ japtavyaḥ sarito jale ||,909
maṃtraḥ || ,910
araviṃdu idu amalamelamaṃgane vidhi vāhinīṃdu sīlaṃ svāhā || 24 || iti <br/>vidhipūrvakāvidhiḥ ||,911
atha vidhātrī || ,912
nadītīre tu yatrāste dhātrī vṛkṣo manoramaḥ |<br/>saphalastasya bhūmau hi kārtike paurṇamāsike ||,913
somavāre tadā maṃtrī niśāyāṃ triśataṃ japet |<br/>homodhātrā phalaiḥ kāryastatastattarute dhruvaṃ ||,914
jāyate tu mahāśabdaḥ prasannāsmīti śobhana |<br/>tanmaṃtra paṭhanānmaṃtrī nīraṃ kṣīraṃ bhavediha ||,915
ityuktiṃ kila saṃbhūtvā sa paṭhenmaṃtramuttamaṃ |<br/>nīropari tato nīraṃ jāyate kṣīramādanāt ||,916
dhyānaṃ ||,917
dhātrī taruśarīrasthāṃ vidhātrīṃ kamalāsanāṃ |<br/>viśālalocanāṃ vaṃde nīrakṣīravidhāyinīṃ ||,918
maṃtraḥ || ,919
oṃ vidhātri nīrakṣīra vidhāyini viṭ svāhā || 16 ||,920
asyaiva pratimaṃtro hi varyovānara bhāṣayā |<br/>tāvāneva japaḥ kāryaḥ na homavidhiriṣyate ||,921
lavaṇasuratīrthe hi japausya parikīrtitaḥ |<br/>tasmin kāle mahāpuṇye vānaraḥ kaściduttamaḥ ||,922
āgatya sādhakendrāya dadyāt kāṃcanakuṃḍalaṃ |,923
59b),924
tatkuṃḍalavalānmaṃtrī jāyate hi mahāvalī ||,925
śilāvṛkṣamahākūpotpāṭanaṃ kurute kṣaṇāt |<br/>hastinaṃ vājinaṃ vāpi kṣaṇāt staṃbhayet kila ||,926
mahāmallagaṇānsaṃhho jayatyāśu na saṃśayaḥ ||,927
maṃtraḥ || ,928
hili vili ke ḍe ke ke ḍe bhīṃ vīṃ bhuṃ svāhā || 14 || iti vidhātrīvidhiḥ ||,929
athavainateyākṣī ||,930
śrāvaṇe māsi nāgānāṃ paṃcamīyā prakīrtitā |<br/>tasyāṃ japenmahāmaṃtrī rātrau vālmīka bhūmiṣu ||,931
ayutaṃ vainate yākṣī homasyānmātu liṃgakaiḥ |<br/>tataḥ sā vainate yākṣī prasannā maṃtriṇe khalu ||,932
dadāti gāruḍīṃ vidyāṃ sarvasarpaviṣāpahāṃ |<br/>sarpāṃgajāti kathanā sarpadaṣṭasu nṛtyakāṃ ||,933
sarpākarṣaṇa śaktiṃ ca mahātakṣaka darśanaṃ |<br/>anyamaṃtri sahasrāṇi na jayaṃtiha tatparaḥ ||,934
dhyānaṃ || ,935
kamalāsanāṃ hi sarpādi veṣṭitāṃ viṃdhyavāsinīm dhyāyāmi vainate <br/>yākṣīṃ viṣadoṣa harāṃvikāṃ || ,936
maṃtraḥ || ,937
oṃ vainateyākṣi sarpa sevite nāgadevi sphīṃ svāhā || 18 ||,938
asyāstu pratimaṃtrā hi mahāsiddhi pradāyakāḥ |<br/>gauḍaśrīhaṭṭa śrīkāmabhāṣābhiḥ sumanoharāḥ ||,939
sadyo gāruḍa cailaṃ hi tadvalāt saṃjayaṃtite |<br/>sarpadaṣṭa pranṛtyaṃ hi tadvārā jāti bhāṣaṇaṃ ||,940
viṣavelāpranirdhāmaḥ nirviṣa praharādayaḥ |<br/>janaṃti maṃtriṇaḥ sarve sarvadeśagatā imāḥ ||,941
vidyā pratyayakāriṇyo bhaviṣyaṃti varānane |<br/>gurūpadeśena vinā sarvaṃ syāt tu nirarthakaṃ ||,942
atreyaṃ gāruḍī vidyā vainate yākṣi nāmataḥ || ,943
etasyānuṣṭhānena gāruḍino jāyaṃte sahasraśo maṃtriṇaḥ || tatra gāruḍavidyā <br/>sarpaviṣārpaharaṇe sarpadhāraṇaṃ | sarpadṛṣṭasya śarīrāt śuddha <br/>nṛtyagānādi | tathā sarpadaṣṭasya mukhena jātyādi kathanaṃ | sarpasya viṣavelā <br/>nirṇayaḥ nirviṣapraharati nirṇayaḥ | tathā sarpastaṃbhaḥ sarpākarṣaṇamityādi <br/>gāruḍakhela || he varānane pārvati maṃtriṇaḥ siddhiṣyaṃtīti pārvatīṃ <br/>pratiśivenopadiṣṭāṃ tataḥ || ete prakārāḥ sarve etasya maṃtrasya saṃtyeva <br/>sarvadeśeṣu lokaprasiddhāḥ ||,944
60a),945
iti vainateyākṣīvidhiḥ || ,946
atha rūpā ||,947
āṣāḍhe māsi rātrau hi kṛṣṇapakṣe'ṣṭamī tithau |<br/>sagarbhīstrī citābhūmāvathavāraṇa bhūmiṣu ||,948
śastra naṣṭācitā bhūmāvayaṃ jāpyo manuḥ kila |<br/>ayutaṃ ca japaḥ proktaḥ pāmarīvījaguggulaiḥ ||,949
homo daśāṃśataḥ proktastato homāṃtamāgatā |<br/>yā yatragata himādriṃ laṃghayennātrasaṃśayaḥ ||,950
abhūmicārī lokeṣu jāyate yogavānasau ||,951
dhyānaṃ ||,952
kuṭajānāṃ vanārūḍha rūpasaubhāgyasuṃdarī |<br/>yoginī mama cittestu kuṭajākṣī manoramā || ,953
maṃtraḥ ||,954
kuṭajākṣi kaṃvalaṃ dehi 2 bhīṃdhaṃ svāhā || 15 ||,955
asyāpi pratirūpaṃ hi kugarairala bhāṣayā |<br/>tathaiva sa tu japtavyo rātrau tatra tithau dhruvaṃ ||,956
dadāti sā jalastaṃbhaṃ devatā kuṭajākṣikā ||,957
maṃtraḥ || ,958
iralaṃgahū iti kāminī bhuvaṃ || 17 || iti kuṭajākṣī ||,959
atha kaṃkarīvidhiḥ || ,960
avṛṣṭi kāle rātrau hi ravau nadyāṃ jale kila |<br/>prajapan kaṃkarī devīmayutaṃ hi tataḥ paraṃ ||,961
prabhāte vṛṣṭirāyāti sā hi paṃcadināvadhi |<br/>ahorātraṃ tato bhūmīrāpūrṇā nīradhārayā ||,962
dhyānaṃ || ,963
kaṃkarīṃ varuṇāpāṇaṃ dhyāyejjala tanuṃ śivāṃ |<br/>vidyucchata svarūpāṃ tāṃ ghoramārjanabhīṣaṇāṃ ||,964
maṃtraḥ || ,965
kaṃkarījalaṃ devījalaṃ pūraya 2 dhaṃ dhaṃ ||,966
asyaiva pratirūpaṃ hi maṃtraḥ kā urabhāṣayā |<br/>tathaiva phaladaḥ sopi japtaḥ sadyo hi maṃtriṇāṃ ||,967
atra sadyo japamātraṃ tataḥ phalado bhavati || na tu homādi japasaṃkhya niyamaḥ || <br/>adyāpi malli deśasya pratīti sarvasaṃmatā || ,968
maṃtraḥ || ,969
hili kili kaṃkarī kāmākṣā hamasamamahīmaṃḍalapāṇīthā uthā <br/>udhaṃrīdhaṃrī svāhā || iti kaṃkarīvidhiḥ ||,970
atha śubhaṃkarī ||,971
varadāyāstaṭe ramye dakṣiṇasyāṃ diśi dhruvaṃ |<br/>māsibhādrapade ṣaṣṭhyāṃ kṛṣṇāyāṃ hi niśāṃtare ||,972
60b),973
kṛta saṃdhyāvidhiṃ samyak samāhitamanāḥ kila |<br/>karavīradrumāṃ yatra nirguṃḍī vanameva vā ||,974
tasmin khanitra vidhinā kṛtakīlakaropaṇaḥ |<br/>prajapedayutaṃ maṃtraṃ karavīra prasūnakaiḥ ||,975
āraktai kīla homasyāt tato devī manoramā |<br/>āyāti divyarūpeṇa kalikāmavimohinī ||,976
nīrājayati taṃ devī svahastena ca maṃtriṇaṃ |<br/>tatastaṃ maṃtriṇe divyānmogānāśu dadāti sā ||,977
yadā yadā hi citte sau yaṃ yaṃ kāmaṃ karoti ca |<br/>taṃ tamā pūrayet sadyo viṣayā pūrayeddhisā ||,978
sraksugaṃdha kalānārī nirmāṇa kurute kṣaṇāt ||,979
dhyānaṃ || ,980
kalākalāpaṃ paripūrayaṃtī vibhāvayaṃtī viṣayānanekān | nārīnarendrānapi <br/>mohayaṃtī sāmānasemestu śubhaṃkarī śrīḥ || ,981
maṃtraḥ || ,982
oṃ śubhaṃkari paradevate mameṣṭaṃ dehi 2 śuṃbhaṃ śrī svāhā || 32 || ,983
asyāpi pratirūpaṃ hi prāyaḥ paiśāca bhāṣayā |<br/>yatra kutrāpi deśesau tanmāse tattithau niśi ||,984
tathaiva phaladāsāsyādayutaṃ japamiṣyate |<br/>drākṣāphalairbhaveddhomaṃ tathā siddhirbhavet tadā ||,985
maṃtraḥ || ,986
mili 2 kili 2 haleṃ śubhaṃkari kāmidaṃgaśca dehi 2 klīṃ || 24 || iti <br/>śubhaṃkarīvidhiḥ ||,987
atha śatanādāvidhiḥ ||,988
māsi śrāvaṇake māyāṃ rātrau dūra nadītaṭe |<br/>navapūraparikrāṃte yayogarjanayāyute ||,989
japet tatra manuṃ devyāḥ sahasrāṣṭaṃ yathāvidhiḥ |<br/>amṛtā mūlaparṇaiśca kṛte home daśāṃśataḥ ||,990
tato rātrau hi jāyaṃte maṃtriṇaḥ pratyayāḥ puraḥ |<br/>vīṇā kinnarīkāyāvapinākī kūrmayaṃtrikāḥ ||,991
ityādinā śataṃ nādā jāyaṃtenyepi bhīṣaṇāḥ |<br/>tataḥ sā yoginī rūpā vakṣovīṇā vinodinī ||,992
navanādakalāviṣṭā pratyakṣā maṃtriṇaḥ kila |<br/>yogamudrāṃ svayaṃ tasmai dadāti kilamaṃtriṇe ||,993
sadyaḥ kuṃḍalinī mārgaṃ sā darśayati maṃtriṇe |,994
61a),995
jñātasvānu bhāvo maṃtrī svānaṃdanaripūrita ||,996
sarvakāmamayaṃ jitvā brahmī bhūya sa tiṣṭhati ||,997
dhyānaṃ || ,998
vīṇānāda sphuradāgha bhāvavikaṃpayaṃtī kilakuṃḍale sve || sā yoginī <br/>viṣṇutayā śivākhyā citte madīye śatanādikāsā || ,999
maṃtraḥ || ,1000
oṃ śatanāde yoginiyogaṃ dehi 2 hrīṃ hrūṃ svāhā || 16 || ,1001
asyāpi pratimaṃtrosti puṇyaḥ pāṃḍīrabhāṣayā |<br/>saṃsāra viṣayāśaktiṃ tyaktvā yogī bhavennaraḥ ||,1002
dadāti tasmai sā devī kaṃthāmekāṃ manoramāṃ |<br/>tayā sa vajradehī syāt kāla kalpaṃ hi jīvati ||,1003
maṃtraḥ || ,1004
śatanāde arma alamekāṃlanatu iḍḍarukuṃḍunnu śrāṃ śrīṃ hrīṃ kaḥ || iti <br/>śatanādāvidhiḥ || ,1005
atha netraramyā || ,1006
kānane karavīrāṇāṃ rātrau vaiśākhamāsi hi |<br/>caturdaśyāṃ japed devīṃ netraramyāṃ śatatrayaṃ ||,1007
bhaumastu vāsaraḥ proktastathā vā śukravāsaraḥ |<br/>ghṛtākta guggulairhome devī sāpya prayacchati ||,1008
dadāti maṃtriṇe tasmai svāṃjanaṃ netravodhakaṃ |<br/>nidhībhūmi gataṃ vastu dūradeśagataṃ tathā ||,1009
ālokayati sa sadyo bhavati bhūpatiḥ || ,1010
dhyānaṃ || ,1011
vivodhayaṃtī pihitaṃ hi vastu māyāmayī paṃkajanetra ramyā | <br/>pītāṃvarā svarṇasuratnamālā puroktame saṃprati netraramyāḥ ||,1012
maṃtraḥ || ,1013
oṃ netraramye aṃjanaṃ dehi 2 nidhidarśaya 2 paṭalaṃ dūrī kuru 2 maṃthaṃ <br/>svāhā || 32 || ,1014
asyāstu pratimaṃtro hi kāśmīra deśa bhāṣayā |<br/>tathaiva phaladaḥ proktastathā corapravodhakaḥ ||,1015
maṃtraḥ || ,1016
sohi tanaya nārī mohibhālaṃ malakāla vodhakara bhrīṃ dhrīṃ svāhā || iti <br/>netraramyāvidhiḥ ||,1017
atha paṃkajākṣīvidhiḥ ||,1018
vasaṃtakāle gaṃgāyāṃ bhāgīrathyāṃ niśāṃtare |<br/>aṣṭamyāṃ caitramāse hi kṛṣṇepakṣe japennaraḥ ||,1019
paṃkajākṣīṃ mahāvidyāṃ palāśānāṃ vanāṃtare |<br/>atra bhaumotha vā śukro vihito vāsaro mataḥ ||,1020
61b),1021
japaḥ sahasraṃ tritayaṃ pālāśairhomamiṣyate |<br/>tato devī mahārātrau gate sati moramā || ,1022
pratyakṣā maṃtriṇe śīghraṃ dadāti phalamuttamaṃ |<br/>jarāmaraṇa rāhityaṃ tatkālaṃ bhakṣite sati ||,1023
phalaṃ tasmin samāpnoti sadguru prārthanā yutaḥ ||,1024
atha dhyānaṃ || ,1025
ālolanetrāṃ kusumeṣu jīvasaṃdāyinīṃ saṃprati paṃkajākṣīṃ || <br/>dhyāyāmi sarvārthakarīṃ bhavānīṃ punarbhaveyāṃ parivārayaṃtī ||,1026
maṃtraḥ || ,1027
oṃ paṃkajākṣi amṛtaphalaṃ dehi 2 svīṃ svāhā || 17 ||,1028
asyāpi pratimaṃtroyaṃ proktaścotkalabhāṣayā |<br/>sa sadyo jvarapīḍāṃ hi haratyā vṛttibhiḥ kila ||,1029
daśabhiḥ parijaptaśca śītapīḍāṃ nivartayat |<br/>yatra kvāpi japaḥ proktaḥ kasmiṃścit samayetha vā ||,1030
kṛttrimāṇi haratyāśu kṛtyādīni sa kṛnmanuḥ | ,1031
oṃ paṃkajākṣī gomāmotheṃyājaratīya haragobhī bhūṃ bhrūṃ svāhā || iti <br/>paṃkajākṣīvidhiḥ || ,1032
atha payodinīvidhiḥ || ,1033
varṣāsucaya dāṣṭamyāṃ rohiṇī ṛṣyasaṃgamaḥ |<br/>bhaumo vṛhaspatirvātha śukraḥ syāt tatra sādhakaḥ ||,1034
rātrau snānavidhiṃ kṛtvā sarastīre manorame |<br/>ayutaṃ prajaped devīṃ pāyasairhomamācaret ||,1035
daśāṃśena tato devī sākṣāt sātu payodinī |<br/>dadāti karakāmekāṃ maṃtriṇe toṣamāgatā ||,1036
agnidāsya sāṃ mukhye sā kṛtā karakā yadā |<br/>tadā vṛṣṭiḥ patet tatra tatkālaṃ śamate hi saḥ ||,1037
dhyānaṃ ||,1038
varṣaṃtī jalaviṃdūn hi meghamālā manoramā |<br/>śyāmāṃvara parīdhānā me cittestu payodinī ||,1039
maṃtraḥ || ,1040
oṃ payodini jaladhārādhare agniṃśamaya vāṃḍavaṃśamaya ḍhrīṃ htraiṁ śrīṃ <br/>namaḥ || 27 || ,1041
asyaiva pratirūpaṃ hi maṃtro vaṃgālabhāṣayā |<br/>sa japtastatkṣaṇādeva jalavṛṣṭi karoti hi ||,1042
vāḍavāgniṃ mahāgniṃ sthalāgniṃ sarvato mukhaṃ |<br/>nāśayet tatkṣaṇādeva āvṛtyā siddhimāgataḥ ||,1043
yatra kvāpi japaḥ prokto japosya jaladāgame |<br/>ayutaṃ ca tataḥ siddhastvekā vṛtyā hi siddhidā ||,1044
62a),1045
maṃtraḥ || ,1046
aligali āhe māpayodinikyamatakari tu kari tu marakāryapānīthā uguthā ugu <br/>āgniṭā tu jhā u ḍhrīṃ ḍhrīṃ svāhā || iti payodinīvidhiḥ || ,1047
atha pāṃḍavīvidhiḥ || ,1048
vatsarādau ca yā proktā pratiśukrasya vāsare |<br/>tasyāṃ rātrau japenmaṃtraṃ pāṃḍavyā ayutāvadhi ||,1049
kausuṃbha kusumairhomairdaśāṃśena kṛte sati |<br/>prasannā jagatāṃ dhātrīṃ pāṃḍavī pītavāsasā ||,1050
pādastaṃbhaṃ karotyāśu vairiṇo dveṣakāriṇaḥ ||,1051
dhyānaṃ || ,1052
pītāṃvarāpītamālyā pītavarṇa priyā sadā |<br/>pretāsanā tadā devī citte me pāṃḍavī bhavet ||,1053
maṃtraḥ || ,1054
oṃ pāṃḍavī vagale vagalāmukhi śatroḥ pādaṃ staṃbhaya 2 klīṃ dhrīṃ <br/>bhrūṃ varaṃ sphrīṃ svāhā || 22 || ,1055
asyā hi pratimaṃtroyaṃ vidyate pāṃḍyabhāṣayā |<br/>gatiḥ staṃbhakaraḥ sadyaḥ śukra pratipadi dhruvaṃ ||,1056
yadā kadāpi japtavyaḥ sadyaḥ siddhikaro hi saḥ |<br/>atra pūrvavadayutaṃ japaḥ || pūrvavat pratipadi japasya naisyatyo ukta idānīṃ <br/>tadvaiparītya yadā kadāpi pratipadi śukravāsare japosya vihito phalaṃ <br/>pūrvavadeva || ,1057
maṃtraḥ || ,1058
pāṃḍavi iṃdu agamaṃḍalapaṃṭī kālukuṃṭimāḍḍadrī sphrīṃ svāhā || 24 || <br/>iti pāṃḍavīvidhiḥ || ,1059
atha pṛthumadhyāvidhiḥ || ,1060
ṣaṣṭhyāṃ kṛṣṇe kārtike hi svāmikārtika saṃnidhau |<br/>guhāyāṃ cūtavṛkṣasya tale sthitvā hi sādhakaḥ ||,1061
bhūmiśuddhiṃ vidhāyāśu kīlakānanuropya ca |<br/>pṛthu madhyāṃjaperdevīṃ sahasraṃ sādhakottamaḥ ||,1062
cūtaparṇaiḥ kṛte home daśāṃśena sugaṃdhibhiḥ |<br/>miśritairagarūdbhūte tailena ca yathāvidhiḥ ||,1063
atra āmraparṇairagarutaila miśritairhomaḥ cakāro viśeṣaṇa dvaya <br/>samuccayārthaḥ ||,1064
tato devī pṛthu madhyā prasīdati hi maṃtriṇe |<br/>dadāti pīṭhamekaṃ hi bhāminī mohakārakaṃ ||,1065
tatropaviṣṭopi naro narakenāpi dṛśyate |,1066
62b),1067
tatpīṭhaṃ paṃcabhūtāni vahaṃti śirasi svayaṃ ||,1068
tadā rūḍhaḥ sādhakosau jāyate khecaraḥ sadā ||,1069
dhyānaṃ || ,1070
unmatta gajagāṃ devīṃ sthūlāṃgīṃ kanaka priyāṃ |<br/>kārtikeya guhākhelāṃ pṛthu madhyāṃ bhajāmyahaṃ ||,1071
maṃtraḥ || ,1072
pṛthu madhye mānavihastini pīṭhaṃ dehi aṃganāṃ pramohaya vāyavīya gatiṃ <br/>dehi 2 phūḥ phūḥ ṭhaḥ || ,1073
asyā tu pratimaṃtrosti saihilaika svabhāṣayā |<br/>bhāṣayā sa tu japtavya kārtikeya guhāṃtare ||,1074
sahasra tritayaṃ tasya na homo parikīrtitaḥ |<br/>pāṃḍukāṃsaṃ dadātyāśū mā devī maṃtriṇe kila ||,1075
maṃtraḥ || ,1076
pṛthu madhyadhi ilaguneṃguṇa kālukadaṃlu iṃcuḍohāhaḥ || atra saihilaikasvayā <br/>bhāvayeti siṃhaladeśajā bhāṣā proktā || iti pṛthumadhyāvidhiḥ || ,1077
atha pārthivāvidhiḥ ||,1078
nadītīre vṛṣṭikāle caturdaśyāṃ niśāṃtare |<br/>kūlaṃ khanitvā kuharaṃ kartavyaṃ yugasaptakaṃ ||,1079
tatrāṃdhakārapakṣe hi dīpaśūnyedarī gṛhe |<br/>pārthivāṃ prajapenmaṃtrī sahasraṃ daśapaṃca ca ||,1080
homaḥ kadalikākāṃḍaiḥ komalaiśca daśāṃśataḥ |<br/>tatodhva kāle sā devī dīpajvālā sphuradruciḥ ||,1081
dadāti maṃtriṇe śaktiṃ pṛthivyaṃtaravāriṇīṃ |<br/>śaileṣu vivareṣūccaiḥ sughane pṛthivītale ||,1082
kīṭavadbhramate maṃtrī yāvajjalamasau sadā |<br/>tatra tatrātyaṃtamāścaryaṃ paśyati prīti pūrvakaṃ ||,1083
jarāmaraṇa rāhityaṃ prāpnoti pṛthivītale ||,1084
dhyānaṃ || ,1085
pṛthivītalasaṃcāra śālinī vāyumālinī |<br/>bhajāmi pārthivāṃ devīṃ tāruṇyaika pradāṃ śivāṃ ||,1086
maṃtraḥ || ,1087
oṃ pārthivi pṛthivītala saṃcāriṇi vāyumālini tāruṇyaṃ kuru 2 vaṃdhaṃ <br/>svāhā || ,1088
asyāpi pratirūposti maṃtraḥ piṃgalabhāṣayā |<br/>tathaiva phaladaḥ proktaḥ japo rātrau prakīrtitaḥ ||,1089
aṣṭamyāṃ kṛṣṇapakṣe hi bhaumosmin vā sarottamaḥ ||,1090
63a),1091
maṃtraḥ || ,1092
kili 2 hili 2 mili 2 colaṃ rīṭhīṃ kuṃ svāhā || iti pārthivāvidhiḥ ||,1093
atha paṃkavāsinī ||,1094
vaiśākhe śuṣka sarasi kānanejana varjite |<br/>kiṃcityaṃ kilite kiṃcijjalasthala manorame ||,1095
saptarātraṃ japenmaṃtraṃ divasaṃ sūryamaṇḍalāt |<br/>lakṣasaṃkhyaṃ japaḥ prokto homastatra tatpuṣpakaiḥ ||,1096
daśāṃśena vidhātavyastatasāpaṃkavāsinī |<br/>dadāti maṃtriṇe tuṣṭā trijagadvaśakāraṇaṃ ||,1097
kesaraṃ ca sugaṃdhaṃ ca maṃtrī tattilakī sadā |<br/>vasayedbhuvanaṃ sadyo rājānaṃ devatāstathā ||,1098
dhyānaṃ || ,1099
paṃkavāsini śive śiva iti smaravaktra nayanāṃvujalīle |<br/>mānase mamavaśasmara devi pratyahaṃ kamalakānanasaṃsthe ||,1100
maṃtraḥ || ,1101
oṃ paṃkavāsini paṃkajavanivanadevate kesaraṃ dehi siddhiṃ kuru 2 klīṃ śrīṃ <br/>svāhā || ,1102
asyā tu pratirūpaṃ hi maṃtraṃ saubhilla bhāṣayā |<br/>sadyo mohana vidyaiṣā trirātramayutaṃ japet ||,1103
tasminkāle hi divase japaḥ sarasi saṃmataḥ ||,1104
maṃtraḥ || ,1105
iṃdu kuṃḍa navala puru iṃcumāḍiṃcuropini daśa vaṃ vaṃ vaḥ || iti <br/>paṃkavāsinīvidhiḥ ||,1106
atha varānanāvidhiḥ || ,1107
rājyarathyādvāre bhaumavāsare saptamyāṃ kṛṣṇapakṣe | ,1108
japedvarānanāṃ devīṃ trisahasraṃ śuciḥ sthitaḥ |<br/>śaṃkhaiḥ kapardakai homo daśāṃśena tato mataḥ || ,1109
tato varāṇanā devī sakṛt strībhiṣito dhruvaṃ |<br/>dadāti maṃtriṇe caikaṃ kapardakamanuttamaṃ ||,1110
tadā tu patato maṃtrī vāṇijyavidhi jīvanaḥ |<br/>kapardakaṃ sthāpayeddhikanādīnāṃ kusūlake ||,1111
tridināvadhi dhānyaṃ tayāvadvikrayakārakaḥ |<br/>yathecchaṃ tāvadā sveta punastrettridināvadhi ||,1112
rāvaṃdhānyāṃtare kṣiptaṃstadakṣayaṃ karoti saḥ ||,1113
dhyānaṃ || ,1114
sauṃdaryāmṛtasandoha sārībhūtāmivā parāṃ |<br/>vivarddhinī sthirāṃ devīṃ sā bhajettāṃ varānanāṃ ||,1115
maṃtraḥ || ,1116
varāṇane vāmalocani paṇyapālini mālini 2 vrūṃ dhūṃ dhīṃ svāhā ||,1117
asyāpi pratimaṃtrosti divyaḥ pārvata bhāṣayā |<br/>sa tathaiva ca japtavyaḥ paṇyadvāra niśāvidhau ||,1118
sarvaṃ dviguṇaṃ yāti paṇyadravyaṃ gṛhasthitaṃ |,1119
63b),1120
maṃtraḥ || ,1121
kālivāli sohita vaṭaya 2 tūṃdhī svāhā || iti varānanā ||,1122
atha vidhuśreṣṭhā || ,1123
caṃdragrahe somavāre citrānakṣatrasaṃgame |<br/>yāvadvidhu pramoca syāt tāvanmaṃtraṃ japejjaleṃ ||,1124
tato devī vidhuśreṣṭhālokavismayakārakaṃ |<br/>dadāti maṃtriṇe samyak tāṭaṃkaṃ savyakarṇagaṃ ||,1125
pūrṇacaṃdraprabhāśobhitvamāṃpūrṇāṃ karoti tat |<br/>pratijñā vaśago yogī svabhāge kṣapayeddhi tat ||,1126
tato devī pakṣapātātūsmiṃtadavalaṃvane |<br/>tato kāpi vadaṃtyevamamāyāṃ caṃdramā kutaḥ ||,1127
dhyānaṃ || ,1128
caṃdramaṃḍalasaṃsthātāṃ vidhuśreṣṭhāṃ viyadratāṃ |<br/>kāsmīra cārutā ṭaṃkāṃ dhyāyāmi śivavallabhāṃ ||,1129
maṃtraḥ || ,1130
vidhuśreṣṭhe viyadgate mānaṃ pūraya karṇatā ṭaṃkaṃ dehi 2 thaṃ dhrūṃ <br/>hsrīṃ svāhā || ,1131
asyāpi pratirūpaṃ hi maṃtro vaideha bhāṣayā || ,1132
maṃtraḥ || ,1133
cādajīvani cāṃdanirīrapanī dīpamālakhaṃmī dehi hsrīṃ hsrīṃ svāhā || atra <br/>japatithi kālasyānuktaṃ tvena pūrvoktānyeva tithikāla phalāni || iti vidhuśreṣṭā <br/>|| ,1134
atha vāmalocana ||,1135
vāmāyāḥ saṃgamāt pūrvaṃ prajapedvāmalocanāṃ |<br/>śatamātraṃ pūrṇamāsyāṃ viśākhāditya saṃgame ||,1136
sadyaḥ prasannā devī sā vīryā staṃbhaṃ dadāti hi |<br/>apikāṃtāśatāsaṃgame nāsau skhalati mānavaḥ || ,1137
dhyānaṃ || ,1138
rati devī rati prītiṃ kāmakīrtiṃ manoramāṃ |<br/>mama kāmapradāṃ sadyaḥ prabhaje vāmalocanāṃ ||,1139
maṃtraḥ || ,1140
īlīṃ bhīraṃ vaṃ vāma locane vīryaṃ staṃbhaya 2 nādaṃ mā kuru 2 svāhā || ,1141
asyaiva pratirūpaṃ hi maṃtraḥ śikharibhāṣayā |<br/>mahānadī taṭe japto veśyā vidrāvaye kṣaṇāt ||,1142
pūrvavajjapasaṃkhyā syāddhomaḥ padmairihoditaḥ || ,1143
maṃtraḥ || ,1144
vāmalocanimāye ma isadāre gaṇaṃ hāṃ haṃ svāhā || iti vāmalocanā || ,1145
atha citrākṣī || ,1146
akṣa?yākhyā tṛtīyāyāṃ uddiśya jalakuṃbhake |,1147
64a),1148
yamaṃ varuṇamiṃdraṃ ca taṣṭhīrasya tu saṃsthitaṃ ||,1149
kuṃbhāpūraṇa kāle hi madhyāhne prajapenmanuṃ |<br/>atha brahmaviṣṇvīśāye pūrvakuṃbhadevatāḥ ||,1150
tānsarvānadhiruhyaiṣā japtavyā cāpagā taṭe |<br/>triśataṃ ca japaḥ prokto homaḥ sīvaphalena hi ||,1151
tato ghaṭamukhādevī pratyakṣā vadati sphuṭaṃ |<br/>akṣayaṃ kurute dravyaṃ maṃtriṇe nātra saṃśayaḥ ||,1152
tṛtīyā somasaṃyuktā tṛtīyā ravi saṃyutā |<br/>citrā ṛkṣa bhavedyogastadāsau japa ucyate ||,1153
atra cendrādayo devāḥ pūrvaṃ kuṃbhasthānadhiruhyatiṣṭhatītyekā kalpanā | <br/>brahmaviṣṇvavīśeti nipāta | te ye devatā kuṃbhetānādhiruhyatiṣṭhatītya <br/>parāvarṇanā || ,1154
dhyānaṃ || ,1155
iṃdrādi pretamaulisthāṃ kalaśāṃkaramālinīṃ || <br/>citrākṣīṃ citraveṣāṃtāṃ saṃbhajet parameśvarīṃ || ,1156
maṃtraḥ || ,1157
citrākṣi citrarūpe iṃdrādi pretasaṃsthe prasīda 2 śrīṃ svāhā || ,1158
asyāpi pratimaṃtrosau jñātavyaḥ kolabhāṣayā | <br/>madhyāhne sa tu japtavyastattithau tatphalapradaḥ || ,1159
maṃtraḥ || ,1160
citraṃ cakhusīmāradhana apārabhaurīṃ svāhā || 16 || iti citrākṣī ||,1161
atha citrakaṃṭhī || ,1162
vasaṃte śuklapakṣe hi caitre māse niśāvidhau |<br/>caturdaśyāṃ japenmaṃtra citrakaṃṭhe phalapradaṃ ||,1163
japaḥ sahasra tritayaṃ homo daśaguṇo mataḥ |<br/>madhūka kusumaiḥ paścāddhomosau parikīrtitaḥ ||,1164
tato devīmudaṃyātā dadāti kilamaṃtriṇe |<br/>kokilasvaramatyaṃta mohanaṃ jagatāmapi ||,1165
api pakṣī mṛgādīnāṃ mohanaṃ susvaro mataḥ ||,1166
dhyānaṃ || ,1167
cūtāṃkuraṃ karṇayuge vahaṃtī vāmaṃ ca ramyāramaṇī śivasya || <br/>sā mānase me sadā śubhāsyā trailokya pūjyā kila citrakaṇṭhī || ,1168
maṃtraḥ || ,1169
citrakaṃṭhī citranādasvaraṃ dehi 2 bhīṃ rīṃ svāhā || 17 || ,1170
asyaiva pratimaṃtro hi prāyaśo marubhāṣayā |<br/>tathaiva phaladaḥ proktaḥ tatkāle parisevitaḥ ||,1171
maṃtraḥ || ,1172
sāmhārogalūṃ citrakeli vāṃsaṃ svāhā || iti citrakaṃṭhī || ,1173
64b),1174
atha cihnagamyā || ,1175
citrāyāṃ kṛṣṇapakṣe hi rātrau siddhipradāṃ japet |<br/>caturthyāṃ cihnagamyātāmayutaṃ caṃdravāsare ||,1176
na homo nāpi pūjyānyā devī sākṣāt priyaṃvadā |<br/>tato dadāti tasmai sā maṃtriṇe varamuttamaṃ ||,1177
