text,paragraph
parastriyaṃ dharṣayaṃti madyaṃ khādaṃti nityaśaḥ |<br/>taṃ dṛṣṭvānucitaṃ karma brahmāmāṃsamupasthitaḥ ||,1431
devadeva mahādeva sṛṣṭisthitilayātmaka |<br/>etadāruvane pāyānmadyapānaratāstathā ||,1432
parastrīyaṃ dharṣayaṃti madyaṃ khādati mohitāḥ |<br/>digaṃvarāśca muṃḍāśca gatireṣā kathaṃ bhavet ||,1433
iti brahmavacaḥ śrutvā tamuvāca ahaṃ priye |<br/>pitāmaha na jānāsi cīnācārakramaṃ bhavān ||,1434
ugratārāṃ mahāvidyāmete nityaṃ jayaṃti hi |<br/>pūjayaṃti ca tāmeva cīnācāraparāyaṇāḥ ||,1435
sādhakāḥ sarva evete mahākaulā mahāśayāḥ |<br/>jīvanmuktiṃ gatāḥ sarve devī bhaktiparāyaṇāḥ ||,1436
parastrīdharṣaṇāccaiva madyapānācca nityaśaḥ |<br/>aśvamedhādapyadhika labhaṃte phalamuttamaṃ ||,1437
etāstu niṃdanmohācca mahāpātaka vātmavān |<br/>ito dūraṃ prayāhitvaṃ na māṃ spṛśa pitāmaha ||,1438
ityaiva muktasamayā brahmāloka pitāmahaḥ |<br/>paraṃ vismayamāpannaḥ saṃśayā viṣṭamānasaḥ ||,1439
kimidaṃ śaṃbhunā proktaṃ vedācāravahiṣkṛtaṃ |<br/>iti saṃciṃtayan maunaṃ prāyapaṃkajasaṃbhavaḥ ||,1440
tato vaikuṇṭhamāsādya śrīviṣṇuṃ parameśvaraṃ |<br/>kṛtāṃjali puṭo bhūtvā sarvamevamuvācasaḥ ||,1441
devadeva mahāviṣṇo saṃsārasthiti kāraka |<br/>chiṃdhi me saṃśayaṃ deva mahāṃtaṃ manasi sthitaṃ ||,1442
tvadanyaḥ saṃśayasyāsyacchettā kaścinna vidyate |<br/>tīrthaparyaṭanāyadyadgataṃ dāruvanaṃ mayā ||,1443
72a),1444
tatra sarve munigaṇāḥ parastrīdharṣaṇe ratāḥ |<br/>madirāpānasaṃjāta sadā ghūrṇitalocanāḥ ||,1445
ramamānī parastrībhirnirlajjā sarva eva hi |<br/>evaṃ tān sudurācārān dṛṣṭvā kailāsavāsinaṃ ||,1446
mahādevamavocaṃ tat sarvameva dayānidhe |<br/>pāpācārānapi munīn prasaṃśaṃ sa maheśvaraḥ ||,1447
śraddhayā parayāviṣṭastānuddiśya punaḥ punaḥ |<br/>uvāca sādhavaste vai jīvanmukto mahāśayāḥ ||,1448
tānniṃditvā mahāpāpa jajuḥ dūramito yataḥ |<br/>tato haṃ vismayāviṣṭaḥ prāptastvāṃ jagadīśvara ||,1449
etanme saṃśayaṃ chiṃdhi cet kṛpāmapi vartate |<br/>evaṃ sa brahmaṇā proktā viṣṇuḥ sarveśvaraḥ prabhuḥ ||,1450
bhaktyā paramayāyuktastān munīnpraṇatāmyahaṃ |<br/>uvāca ca vidhātāraṃ tatvajñānamayaṃ vacaḥ ||,1451
tvayā dāruvane dṛṣṭvā munayo ye pitāmahaḥ |<br/>tārāmārādhayaṃte tu sarve sādhakasattamāḥ ||,1452
parastriyaṃ dharṣayaṃti madyaṃ khādaṃti nityaśaḥ |<br/>nirvāṇaṃte tu yāsyaṃti bhagavatyāḥ prasādadaḥ ||,1453
cīnācāraṃ samāśritya munayaste mahāśayāḥ |<br/>tatvajñānamayā sarve viharaṃti mahītale ||,1454
tvamāśugaccha tatraiva tān prasādaya padmaja |<br/>teṣu vyaṣṭiṣu bhavato brahmatvamapi yāsyasi ||,1455
mahādevena yat proktaṃ tasya me tanna saṃśayaḥ |<br/>āvayosana saṃspṛśya sādhakānyo vinindati ||,1456
śrīśiva uvāca ||,1457
tato viṣṇuṃ praṇamyāsau parameṣṭhī tvarānvitaḥ |<br/>gatvā dāruvanaṃ sarvān praṇanāma munīśvarān ||,1458
tuṣṭāva parayā bhaktyāstatrairvahu vidhairapi |<br/>teṣāṃ prasādaya māsādya kṛtakṛtyo bhavadvidhiḥ ||,1459
72b),1460
śrīdevyuvāca ||,1461
mahācīna kramācāraṃ tato vuddhādi vāśu ca |<br/>vasiṣṭhaḥ sa kimakarottanme vrūhi maheśvara ||,1462
śrīśiva uvāca ||,1463
mahācīna kramācāra tato vuddhyādi vāpyasaḥ |<br/>nīlācalaṃ samāsādya kulācāra parāyaṇaḥ ||,1464
tatokṣamālāṃ yuvatīṃ cāṃḍālīnu mayenmuniḥ |<br/>japan saṃsādhayāmāṃsatārāṃ mukti pradāmimāṃ ||,1465
madirābhipānamattābhirmadirā madaghūrṇitaḥ |<br/>tārāmārādhayāmāsa kṛta kṛtyo bhavat tadā ||,1466
sākṣādbhūtā mahādevī tārā saṃsāratāriṇī |<br/>tamuvāca vasiṣṭhatvaṃ varānvṛṇu yathepsitān ||,1467
vasiṣṭha uvāca ||,1468
tāre devi jaganmātaḥ jñānavijñānadāyini |<br/>varameva vṛṇetvannaḥ prasannā dehi hime śive ||,1469
mahācīna kramācārairyastvāṃ saṃpūjayiṣyati |<br/>sarvadā tasyārcakasya sākṣātvaṃ hi bhaviṣyasi ||,1470
śrīdevyuvāca ||,1471
cīnācāreṇa yaḥ kaścit tārāṃ māṃ pūjayiṣyati |<br/>sa me putra tayāgatya satyaṃ satyaṃ na saṃśayaḥ ||,1472
iha bhogān varān bhuktvā bṛhaspatirivāparaḥ |<br/>aṃte yāsyati matpārśvaṃ yatra me gaṇanāyakaḥ ||,1473
rūpayauvanasaṃpanno rudrakanyāgaṇaiḥ saha |<br/>vihariṣyaṃtyasau vīro yāvaccaṃdrārkatārakaṃ ||,1474
tavāpi bhavitā vatsa yoga siddhiranuttamā |<br/>aṇimāḥ siddhayastvaṃ me bhaviṣyaṃti niraṃtaraṃ ||,1475
iti labdhavarastasyā vasiṣṭhosau mahāmuniḥ |<br/>nakṣatralokamāsādya adyāpi dyotate divi ||,1476
eṣate kathito devi cīnācāraḥ sudurlabhaḥ |<br/>samācaran sādhakendro bhuktimuktiṃ ca viṃdati ||,1477
etat sarvaṃ prayatnena gopitavyaṃ tvayā priye |,1478
73a),1479
yathā hyanyo na labhate tathārpaṃ ca maheśvari ||,1480
svayoniriva deveśi goptavya paśusannidhau |<br/>yo bhaktaḥ sādhako jñānī tasmai vaktavyameva hi ||,1481
ityācārasāratantre paṃcamaḥ paṭalaḥ ||,1482
śrīśiva uvāca ||,1483
athātaḥ saṃpravakṣyāmi rahasyaṃ śṛṇu pārvati |<br/>yonimaṇḍalamāsādya mūlamaṃtra japet tu yaḥ ||,1484
ṣaṇmāse siddhimāpnoti vināhomārcanādibhiḥ |<br/>yonimudrāṃ vijānāti mūlavidyāṃ śṛṇoti yaḥ ||,1485
tasyā cirādaṣṭa siddhistannāti yanna sādhayet |<br/>yadi bhāgyavasādeva yonimudrāṃ vilokayet ||,1486
praṇamya daṇḍavadbhūmau manasā japamācaret |<br/>bhagarūpā mahādevī yoginī yonirūpiṇī ||,1487
tasmādyatnena maṃtrajño mahāmudrā samarpayet |<br/>aṣṭamyāṃ ca caturdaśyāṃ maṃgale śanivāsare ||,1488
yoginī kuru vaṃdaiśca saṃsthitā yonimaṃḍale |<br/>yonimaṃḍala tatvajñaḥ kuladravyaparāyaṇaḥ ||,1489
sa rudra iti vijñeyaḥ sarvaśāstreṣu niścitaṃ |<br/>yonau pūjāṃ nācaraṃśca māṃsaṃ madhye tathā madhu ||,1490
kuladravyāṇi caitāni bhakṣayet kulakaulikaḥ |<br/>madirānaṃda sānaṃdo māṃsamudrāśanonavā ||,1491
paṃcatatvaṃ na seveta sa kathaṃ kulakaulikaḥ |<br/>madyaṃ māṃsaṃ tathā matsyaṃ mudrāṃ maithuna karma ca ||,1492
na sevate yadā devī sa kathaṃ kulakaulikaḥ |<br/>paṃcatatvaṃ vinānāsti śaktīnāṃ bhukti muktiṣu ||,1493
tasmāt sarvaprayatnena paṃcatatvaṃ nivedayet |<br/>devīṃ saṃpūjayitvā tu tasyāṃ saṃbhakṣayen naraḥ ||,1494
niṣevya paṃcatatvāni sarvadānaṃdamānasaḥ |<br/>kulajñānāṃ melanena viharet kulabhairavaḥ ||,1495
73b),1496
saṃsthāpyamāme kulajāṃ kulapūjārato bhavet |<br/>deyaṃ tasmai madyamāṃsaṃ khādyaṃ tanmukhataḥ priye ||,1497
praviśya yonimudrāṃ ca japen maṃtramananyadhīḥ |<br/>ātmānaṃ bhairavaṃ matvā yoniṃ bhagavatīṃ tathā ||,1498
bhairavācara saṃpannaḥ praviśedyoni maṃḍale |<br/>āliṃgya yuvatīṃ gāḍhaṃ saṃcuṃvyādharameva ca ||,1499
daṃtakṣataṃ nakhāghātaṃ tatra tatra vinirdiśet |<br/>kulodbhavena dravyeṇa pūjayet tarpayeccayaḥ ||,1500
sa eva sādhakajñānī kulajñānī na saṃśayaḥ |<br/>yadi gacched bhagavati kapaṭaṃ caiva kārayet ||,1501
devī guṇavatī tasya sarvaṃ nāśayati dhruvaṃ |<br/>yā śaktiḥ sā mahādevī kevalānaṃdarūpinī ||,1502
tadyoge naiva mukta syāt sādhako vīrarūpadhṛk |<br/>iti jñātvā japed vidyāṃ kevalaṃ bhāvatatparaḥ ||,1503
jāti sa bandha vuddhiṃ ca na kadāpi ca sādhakaḥ |<br/>ciṃtayet taṃ ca deveśi narakaṃ pratipadyate ||,1504
ucchiṣṭaṃ bhakṣayet tāsāṃ dadyānnocchiṣṭameva hi |<br/>śaktyucchiṣṭaṃ pived dravyaṃ vīrocchiṣṭaṃ tu carvaṇaṃ ||,1505
śaktivīra prasādena kinna sidhyati bhūtale |<br/>ānaṃdapūrṇa hṛdayo viharet kulabhairavaḥ ||,1506
raktacaṃdanadigdhāṃgastāṃvūlapūritānanaḥ |<br/>raktamālyāṃvaradharo rakta kopīṇa bhūṣaṇaḥ ||,1507
śaktimākṛṣya yatnena kulācārarato bhavet |<br/>tasmād yatnena maṃtrajño tāvacchakti parāyaṇaḥ ||,1508
evaṃ taṃtraṃ ca maṃtraṃ ca gopayen mātṛjāravat |<br/>mohāt prakāśādacirādadhoyāti na saṃśayaḥ ||,1509
ityācārasāratantre rahasyakathane ṣaṣṭhaḥ paṭalaḥ ||,1510
śrīdevyuvāca || ,1511
devadeva mahādeva mahākāruṇika prabho |<br/>yoginīnāṃ sadāsevyaṃ kaulānāṃ valapuṣṭidaṃ ||,1512
74a),1513
manaścāṃcalya haraṇaṃ kiṃ samādhi phalapradaṃ |<br/>vadasva tada śeṣeṇa yadyahaṃ tava vallabhā ||,1514
śrīśiva uvāca ||,1515
akathyate taccārvaṃgi devāsura nareṣvapi |<br/>kathayāmi tava prītyā guhyādguhyataraṃ mahat ||,1516
śrutvā tvayāpi goptavyaṃ yatnena paśusaṃkaṭe |<br/>valo nāma mahānāsīdasurāvalavān purā ||,1517
jitvā suragaṇān sarvānindrobhūt svayameva saḥ |<br/>tataḥ palāyitāḥ sarve bhayodvignā divaukasaḥ ||,1518
puraṃdaraḥ purodhānaṃ maṃtrayitvā suniścitaṃ |<br/>nānyosti tasmādasmākaṃ trātā śrīmadhusūdanāt ||,1519
iti saṃciṃtya sarve te prayayuḥ parameśvaraṃ |<br/>saṃstūyamānamṛṣibhiḥ siddhakinnarasevitaṃ ||,1520
tāṃ dṛṣṭvā puṇḍarīkākṣaḥ praṇamed daṇḍavadbhuvi |<br/>ūcuḥ prāṃjala yaścaite devāḥ śakra purogamāḥ ||,1521
namostu haraye tubhyaṃ sarvaduḥkhaṃ ca hāriṇe |<br/>surāṇāmārtināśāya sarveśāya namo namaḥ ||,1522
namastrimūrtaye tubhyaṃ sṛṣṭisthityaṃta kāriṇi |<br/>guṇātītāya śuddhāya paratopi parāya ca ||,1523
sarvātmane nanastestu sarvaśakti yutāyate |<br/>sarvajñāya sarvalokasākṣiṇe iti stutvā ||,1524
sakalaṃ tadvṛttāṃtaṃ nivedaya śaraṇaṃ gatāḥ | <br/>sarve trāhi nastaṃ nihatya ca durācāro valamukhā yathāyātya ciraṇate ||,1525
rakṣā smākaṃ ca śakrasya tathā kartutva marhasi |<br/>śrutvedaṃ vacanaṃ teṣāmidamāha puraṃdaraṃ ||,1526
vṛttāṃtametajjānāmi valasyāsya durātmanaḥ |<br/>brāhmaṇā samayā vāpi na sa vadhyaḥ śivena vā ||,1527
tvayi vadhyaḥ sa bhavitā sa durātmāna saṃśayaḥ |<br/>etat sarvaṃ maheśāya nivedaya puraṃdaraḥ ||,1528
sa eva bhagavān sarvametajjānāti śaṃkaraḥ |<br/>tāvat tilaṣite sarvaṃ sa vidhāsyāti gamyatāṃ ||,1529
74b),1530
prasādyatāṃ ca yatnena tvayāsau bhaktavatsalaḥ |<br/>atha praṇamya śaktastvaṃ sa māyāto mamāṃtikaṃ ||,1531
āgatya śuddhabhāvosau praṇamya ca kṛtāṃjaliḥ | ,1532
tuṣṭuve vividhaistotrairbhakti gadgadabhāṣitaṃ mādhyānoparatamīśvaraṃ ||,1533
stotra pāthairvahuvidhai manudbhavanināditaiḥ |<br/>mahadbhiḥ parito jñātaṃ sarvatadeva śeṣataḥ ||,1534
asya vadhya savalodurātmāsau bhaviṣyati |<br/>sa vidhya bhedvijñāya śakramāhūya sannidhiṃ ||,1535
tasmai tatparamaṃ jñānaṃ datvāroc midaṃ vacaḥ |<br/>trailokyavijayājñāṃ etat trailokya durlabhaṃ ||,1536
aśeṣapāpaśamanaṃ parātmā svaprakāśakaṃ |<br/>akhaṃḍānaṃdanilayamadvaitaparamāspadaṃ ||,1537
manasthairyaḥ karaṃ roga śokasaṃtāpanāśanaṃ |<br/>valapuṣṭikaraṃ samyak yogasiddhikaraṃ mahat ||,1538
niṣevyatāmiyaṃ saṃvit sthīyatāṃ ca matāṃtike |<br/>tato gatvā vatsarāṃte sa vale jeṣyate tvayā ||,1539
ityemukta samayā prāṃjaliścedamavravīt ||,1540
śakra uvāca ||,1541
devadeva mahādeva sarvajña sarvatatvavit |<br/>vidhinākena sevyoyaṃ ko vā maṃtraviśodhane ||,1542
tarpaṇasvīkṛtau maṃtraḥ savide kṛpayā vibho |<br/>sarvametadaśeṣeṇa sāṃgopāṃga vadasva me ||,1543
śrīśiva uvāca ||,1544
śṛṇu śakra mahābhāga sarvametad vadāmi te |<br/>śrutvā gopaya yatnena tadevācara nityaśaḥ ||,1545
trailokyavijayākṣyāpānāmāni prathama kramāt |<br/>kathayāmi tava snehādati guptāni sarvataḥ ||,1546
trailokyavijayā siddhimāsotha śuddhimūlikā |<br/>jñānaṃ ca samvidā śyāmā bhaṃgā gaṃjāraśāyaṇā ||,1547
yogadā yogasaṃsevyā yogamārgāpradarśinī |<br/>brahmāṇī brahmasaṃbhūtā brahmānaṃdapradāyinī ||,1548
vāgdevatā vaśaṃkarī vijayā vijayapradā |,1549
75a),1550
samādhirivadājñāna nāśinītvekaviṃśatiḥ ||,1551
śvetaraktapītakṛṣṇapuṣpabhedaiścaturvidhā |<br/>śvetapuṣpa brāhmaṇī sā kṣatriyā raktapuṣpikā ||,1552
pītapuṣpā tu vaiśyā sā śūdrā tu kṛṣṇapuṣpikā |<br/>ākṛṣṇampatrāṇye teṣā sa vijānīyā prayatnataḥ ||,1553
bharjitāni ghṛtenaiva cūrṇitāni śilātale |<br/>trikaṭu triphalā śṛṃgī kuṣṭaṃ dhanyāka saiṃdhavaṃ ||,1554
śaṭhī tālī sa patraṃ carūkkalaṃ nāgakesaraṃ |<br/>yavānī dvayamethī ca jīrakatvayameva ca ||,1555
etāni samabhāgāni raudraśuṣkāni cūrṇayet |<br/>gṛhītvā cūrṇameteṣāṃ saṃviccūrṇaṃ tu tatsamaṃ ||,1556
uye ca samaṃ datvā sitātanmiśrayed guḍaṃ |<br/>miśrayitvā caturthāṃśa samaṃ madhu ghṛtaṃ tathā ||,1557
punaḥ śilātale piṣṭvā triṣugaṃdho pravartayet |<br/>svarṇādi pātre purataḥ sthāpayitvā tataḥ kramāt ||,1558
caturbhirmanubhistāsāṃ śodhanaṃ ca samuccaret |<br/>niveśya tatra pālyagnaṃ yathāvidhi viśodhayet ||,1559
oṃ samvide brahmasaṃbhūte brahmaputri sadā naghe |<br/>bhairavānāṃ ca tṛptyarthaṃ paritrā bhava sarvadā ||,1560
oṃ brāhmaṇyai namaḥ svāhā || brāhmaṇī śodhanamanuḥ || ,1561
oṃ siddhimūli kriye devi hīnavodha pravodhini | <br/>rājāprajāvaśakarī śatrūkaṃṭha triśūlinī || ,1562
oṃ kṣatriyāyai namaḥ svāhā || śodhayeda parā tataḥ || ,1563
ajñāne dhanadīptāgne jvālāgni brahmarūpiṇī |<br/>ānaṃdasyāhuti prītiṃ samyak jñānaṃ prayacchame ||,1564
oṃ hrīṃ vaiśyāyai namaḥ svāhā || śūdrāṃ śodhayet tataḥ || oṃ namasyāmi <br/>yogamārarjapradarśinī || ,1565
trailokya vijaye mātaḥ samādhi phaladā bhava || ,1566
klīṁ śūdrāyai namaḥ svāhā || oṃ amṛte amṛtodbhave amṛtavaṣiṇi ||,1567
75b),1568
amṛtamākarṣayākarṣasiddhiṃ dehi amukaṃmeva vaśamānaya svāhā || ,1569
iti paṭhitvā tatra ānaṃdabhairavānaṃdabhairavyormaṃtravayat || ,1570
śivasomo mātṛkāṃtaṃ kālabhūvaruṇānanā |<br/>vāmakarṇasamāyuktaṃ vāyumūrdhendu saṃyutaṃ ||,1571
anaṃdabhairavāyeti śikhāmaṃtraṃ tato vadet |<br/>ānaṃdabhairavāpyā tu mānaṃda bhairavīṃ śṛṇu ||,1572
pūrvavadvījamālikhya caṃdraṃ hitvādimaṃlayet |<br/>karṇe vāmākṣi saṃyojya sudhā devyai dṛśoḥ * * ||,1573
mūlamaṃtraṃ saptavāraṃ tasyopari niyojayet |<br/>āvāhanyādi mudrāṃ ca dhenu yonī tataḥ paraṃ ||,1574
digvaṃdhanaṃ choṭikābhiḥ tālatrayapuraḥsaraṃ |<br/>divyadṛṣṭyā tathā pārṣṇighātairvighnān vighātayet ||,1575
sāyudhā tarpayed brahmaraṃdhre mūlaṃ japanmanuṃ |<br/>guruṃ padmasahasrāre tathā saṃketamudrayā ||,1576
tridhā vā tarpayed bhaktyā sakṛdvāpi nijecchayā |<br/>paramākhyaṃ guruṃ tatra parāpara guruṃ tataḥ ||,1577
taṃtreṇānaṃdabhairavyostarpayecca manuṃ smaran |<br/>hṛdaye tarpayed devīṃ mūlena tatvamudrayā ||,1578
samvidātri sakṛdvāpi tilamudgapramāṇayā |,1579
aiṁ aiṁ vada 2 vāgvādini mama jihvāgre sthirī bhavaḥ sarvaṃ satvaravaśaṃkari <br/>svāhā || ityakau juhuyān mukhe | mukhāmṛteradicaine svīkuryāt tataḥ || ,1580
dugdhāṃ tu ghṛtamādhvīkasai karairnavalena vā | <br/>sitayātha gudenāpi paṃkena kadalena vā ||,1581
yadyadvā madhuraṃ dravyaṃ pakvāmraṃ panasādikaṃ |<br/>tena sarveṇa vijayāṃ svīkuryāt sādhakottamaḥ ||,1582
dugdha yogena vijayā kevalānaṃdadāyinī |<br/>mahātejaskarī cakṣurdoṣādi vinivāriṇī ||,1583
ghṛtena medhāmādhatte vāgdevī vaśakāriṇī |<br/>pratibhā muttamādhattedhiṣaṇāṃ cāti nirmalaṃ ||,1584
76a),1585
kaphadoṣānaśeṣāṃśca madhunā saha nāśayet |<br/>saiṃdhavena mahāvahni pradāsyāllavaṇena ca ||,1586
sitayātha guḍenāpi śūlāmla pittanāśinī |<br/>atisāropaśamanī śvāsakāśa pramardinī ||,1587
āmavāta samudbhūta grahaṇī vinivāriṇī |<br/>sarvairvā madhurairyuktā sarvāmayavināśinī ||,1588
valapuṣṭipradā caiva madhurasvaradāyinī |<br/>jñānavijñānadā nityaṃ śīlamārgaprakāśinī ||,1589
vahunātra kimuktena kevalācit prakāśinī | ,1590
prakāśitā tava snehāt sarvamānaveṣu gopitā |<br/>atha svīkṛtya saṃciṃtya sahasrāre guruṃ yajet || ,1591
pādukāmaṃtramuccārya caturthyaṃtaṃ nivedayet |<br/>paṃcabhūtottha vījaiśca gaṃdhādi paṃcakaṃ diśet ||,1592
praṇame daṃḍavadbhūmau japtvā śrīgurupādukāṃ |<br/>iṣṭadaivatvatanmaṃtraṃ prajapan viharet kṛtī ||,1593
evamadyāt tataḥ śakra pratyahaṃ vatsaraṃ tataḥ |<br/>tejasvī valavān vāgmī medhāvī priyadarśanaḥ ||,1594
rūpayauvanasaṃpanno nānāguṇasamāśrayaḥ |<br/>bhaviṣyati na saṃdeho dravyasyāsya niṣevaṇāt ||,1595
saṃvidaḥ kevalāyā tu sevanāt kiṃ prasidhyati |<br/>saṃvidāsārayormadhye samvidaikagarīyasi ||,1596
saṃvit prayogate nehaṃ kartavyaḥ sādhakottamaḥ |<br/>ekakālaṃ dvikālaṃ vā trikālaṃ paṃcakālakaṃ ||,1597
tolakaṃ vā tadardhe vā tolaka dvayameva ca |<br/>na ca nyūnādhikāmātrā yathā bhavaṃti nityasaḥ ||,1598
nyūnādhikā yā mātrā yā phalaṃtakṣanna jāyate |<br/>tasmāt pramāṇamātrā hi kartavyā siddhimicchatā ||,1599
etat te kathitaṃ sarvaṃ vijayākalpamuttamaṃ |<br/>prasādādacirādanyaṃ vāṃchitaṃ te bhaviṣyati ||,1600
76b),1601
ityuktaḥ samayā śakto nirbhavānaṃdamārdavaiḥ |<br/>bhaktyā paramayā yuktastatkartumupa cakrame ||,1602
saṃvatsaraṃ pratidinaṃ prayatastrikālaṃ śakro niṣevya vijayāṃ vidhinā <br/>vasiṣṭha || jitvā valāsuramabhūtha devarāja prāpapya viśvaśamanasya sa <br/>labdhakāmaḥ || etadrahasyamuditaṃ paramaṃ nigūḍhaṃ kutrāpi naiva <br/>kamanīyamidaṃ kadācit || utkaṃṭhayā tava mayānanu pūrvavṛttaṃ devitvamapi <br/>vidhinā pravidhīyatā tat || ,1603
ityācārasāratantre haragaurīsaṃvāde paramarahasyātirahasyakathane <br/>saṃvidākalpe saṃvicchodhanasvīkāravidhiḥ samāptaḥ paṭalaḥ ||,1604
atha samayācāraḥ || ,1605
śrīgaṇeśāya namaḥ || ,1606
pārvatyuvāca || ,1607
bhagavan guṇaguṇādhāra sarvatra karuṇānidhe |<br/>idānīṃ śrotumicchāmi samayācāramuttamaṃ || 1 ||,1608
yatpurā samayācāraṃ pūrvāmnāyeṣu kīrtitam |<br/>puṇyaśca śrotumicchāmi ṣaḍāmnāyeṣu kīrtitaṃ || 2 ||,1609
kiṃ nāma samayānātha tasyaścaraṇamuttamam |<br/>tasya saṃketa vijñānaṃ vāṃchitaṃ phalamaśnute || 3 ||,1610
pūrvāmnāyādi cāmnāyādevatāya prakīrtitāḥ |<br/>pṛthak pṛthak kṛte nātha punarvrūhi maheśvara || 4 ||,1611
āmnāyādhiṣṭhitānāṃ ca devatāṃ ca pṛthak pṛthak |<br/>japamālāsanānāṃ ca teṣāṃ vada dayānidhe || 5 ||,1612
bhairava uvāca ||,1613
śṛṇu devi pravakṣyāmi guhyād guhyataraṃ mahat |<br/>samayācārasaṃketaṃ tatvaṃ paramadurlabhaṃ || 6 ||,1614
pūjanādiṣu yaḥ kālo devatā ye pṛthak pṛthak |<br/>sa kālaḥ samayo nāma ye jñātvā'mṛtamaśnute || 7 ||,1615
kāleṣvācaraṇaṃ devi yasya devasya yadvidhiḥ |<br/>taṃ nāma samayācāraṃ devānāmapi durlabhaṃ || 8 ||,1616
77a),1617
saṃkīrtanāt punardevī rahasyānāṃ rahasyakaṃ |<br/>samayācārasaṃketaṃ nāmnā tatra prakīrtitaṃ || 9 ||,1618
athavā samayācārāt samayācāramucyate |<br/>samayā gopanīyānāṃ sadā gopyā prakīrtitāḥ || 10 ||,1619
vidhinā samayā devī ye bhuṃjaṃti ca sādhakaḥ |<br/>te narāstadgatā nityaṃ bhogaṃ kṛtvā sadā bhuvi || 11 ||,1620
ityevaṃ samayānāmnā siddhagaṃdharvasevitāḥ |<br/>asyā vidhānakathanādidṛtaṃtraṃ prakīrtitaṃ || 12 ||,1621
idānī ya ca yā devī kiṃ nāma samayā bhuvi |<br/>kathitaṃ vidhinā bhadre tat śṛṇuṣva varānane || 13 ||,1622
asya śrīvāgvādinī maṃtrasya brahmā ṛṣirdevī vijayāśaktirgāyatrīcchaṃdo <br/>vāgvādinī devatā 1 vījaṃ 2 kīlakaṃ 3 śaktiḥ śrīvāgvādinī prītyarthe jape <br/>viniyogaḥ || ,1623
etairaṃganyāsaṃ kṛtvā saṃvidgṛhītvā evaṃ paṭhanīyaṃ maṃtraṃ || ,1624
aiṁ vada 2 vāgvādinī sāṃ svāhā || ityanena saptābhimaṃtritaṃ bhakṣayet || ,1625
athavā aiṃ jaya 2 vijaya evaṃ brahmasvarūpiṇī sarvajana me vaśamānayet <br/>yanayā svāhā || ityanena vā japitvā bhakṣayet || ,1626
athānaṃtarato devi samayāstotramuttamaṃ |<br/>yena śrutvā siddhi mūlībhakṣitā phaladā bhavet || 20 ||,1627
saṃvide brahmasaṃbhūte brahmaputri sadā naghe |<br/>bhairavānaṃda hetustu sa paṭhitvā sadā bhava || 21 ||,1628
namāmi yāminī nāthāṃ lekhālaṃkṛtamastakam |<br/>bhavānīṃ bhavasaṃtāpapavirvāṇa sudhānidhim || 22 ||,1629
siddhimūlī śriyo devī hi na vodhapravodhini |<br/>rājāprajāvaśakarī kālakaṃṭhī triśūlinī || 23 ||,1630
ajñāneṃdhana dīptāyā jñānāgni jvālarūpiṇī |<br/>ānaṃdādyāhutiḥ samyak jñānaṃ prayacchati || 24 ||,1631
77b),1632
daṃḍādirūḍha paripūrita bhogamokṣa śuṃḍakrameṇa madanaṃ <br/>jayakāminīnām |<br/>ārādhayāmi vahuśatru parājayaṃti viśveśvarīṃ tribhuvane vijayeti devīm || 25 ||,1633
ānaṃdānaṃdinī vaṃde sadānande pada dvayaṃ |<br/>ullāsa kadalīkaṃde svacchaṃde vodharūpiṇī || 26 ||,1634
kavayati kavitā laharīṃ kurute tatvārtha darśanaṃ puṃsāṃ |<br/>apaharati durita nilayaṃ kiṃ kiṃ na karoti saṃvidullāsaḥ || 27 ||,1635
saṃvidāsamayormadhye saṃvideva garīyasī |<br/>bhakṣitābhavanāśāya nirgaṃdhā vodharūpiṇī || 28 ||,1636
susaṃvit chūlinī devī vijayā sa cidaṃ kuru |<br/>vaiṣṇavī tulasī tuṃgā tejo vallīraseśvarī || 29 ||,1637
vimarśādvaitaratvaṃtaṃ vīralakṣmīrmahodarī |<br/>samayā modinī caiva siddhamaulī mahauṣadhī || 30 ||,1638
mātulānī jñānarūpā siddhavidyā sarasvatī |<br/>yāni caitāni nāmāni sevayet siddhimūlikām || 31 ||,1639
samāpnoti parāṃ vidyāṃ bhuktimuktiṃ ca viṃdati |<br/>pāṃḍityaṃ sukavitvaṃ ca maṃtrasiddhiṃ sa viṃdati || 32 ||,1640
samayāṃ gopayed yastu śiṣyabhyaścāpi suṃdari |<br/>vinā na samayā devi bhuktiṃ muktiṃ kathaṃ labhet || 33 ||,1641
vinā samayā devi sāmarthyaṃ naiva jāyate |<br/>sāmarthaṃ sahito devi kāryāṇi sādhayet || 34 ||,1642
vinā samayā pūjāṃ na kutrāpi śubhodayī |<br/>brāhme muhūrte cotthāya pakṣitā pāpanāśinī || 35 ||,1643
tathā sūryodayo jāte madhyāhne bhakṣitā tathā |<br/>tathā parāhne vidhivat sarvapāpavināśani || 36 ||,1644
ardharātrau viśeṣeṇa vāṃchitārtha phalapradaḥ |<br/>vinā tu samayā devi japapūjādikaṃ caret || 37 ||,1645
navasiddhimavāpnoti abhicārāya kalpayet |<br/>apamṛtyuharānūnaṃ rogaśokavināśinī || 38 ||,1646
78a),1647
duṣṭaśatrupraśamanī sarvalokaniraṃjanī |<br/>siddhayo hyaṇimādyāśca tasya haste sadaiva hi || 39 ||,1648
kāyikaṃ vācikaṃ cāpi mānasaṃ caiva duḥkṛtaṃ |<br/>etat sarvaṃ kṣayaṃ yāṃti brahmahatyādi pātakaṃ || 40 ||,1649
samayābhaktinā yena samayādhāritāstathā |<br/>samayāpāsitā yena rahitaḥ sarvakilviṣaiḥ || 41 ||,1650
sa śivaḥ sa ca yogī ca sa tapasvī satī tathā |<br/>sa eva muktimārgasthaḥ samayā yena bhakṣitā || 42 ||,1651
bhakṣayitvā ca samayā yaṃtraṃ maṃtraṃ japennaraḥ |<br/>samaṃstatphalamāpnoti satyaṃ satyaṃ varānane || 43 ||,1652
vinā ca samyā devi maṃtraṃ japati nityaśaḥ |<br/>alpāyuśca bhavet sadyo devatā kopayeddhruvam || 44 ||,1653
dravyādikamabhāvepi nityaṃ karma na lopayet |<br/>pramādā lopayedyastu nārakī bhavatī dhruvaṃ || 45 ||,1654
dravyaṃ caturdaśavidhi śṛṇu devi pṛthak pṛthak |<br/>teṣāṃ madhyena taṃ dravye dve nahye tu kadācana || 46 ||,1655
kṣīraṃ dadhi ca takraṃ ca ghṛtaṃ kṣaudraṃ guḍaṃ tathā |<br/>śarkarāśītalaṃ toya bhairamapyāranālakaṃ || 47 ||,1656
āphūkaṃ samayā caiva dhattūraṃ saṃviṣaṃ tathā |<br/>dhattūraṃ ca viṣaṃ devi dravyaṃ prāṇaprahārakam || 48 ||,1657
anyāni yāni dravyāṇi ānaṃdārthaṃ ca bhakṣayet |<br/>ānaṃda paramaṃ brahma parāśaktiḥ sadāśivaḥ || 49 ||,1658
dravyaśudhyādi sakalamānaṃdārthaṃ ca bhakṣayet | <br/>ānande cāpamānepi bhakṣayen na kadācana || 50 ||,1659
atipānād bhavet sadyo japapūjādi niḥphalā |<br/>buddhināśo bhaved devi tato mātrāṃmitāṃ caret || 52 ||,1660
sā mātrā vartate devi yayānaṃdaṃ pravartate |<br/>ityevaṃ samayācāra kathitaśca varānane || 53 ||,1661
78b),1662
dravyādiśodhanārthaṃ taṃ maṃtraṃ śṛṇu varānane |<br/>guroḥ sakāśāt yaṃtramaṃtraṃ nityaṃ japati yo naraḥ || 54 ||,1663
tenaiva manunāmaṃtrī ṣaḍaṃgaṃnyāsmācaret |<br/>nyāsaṃ kṛtvā punarmaṃtrī dravyādīn maṃtrayed budhaḥ || 55 ||,1664
saptābhimaṃtritaṃ kṛtvā phalaṃ sarvaṃ bhaveddhruvam |<br/>guruṃ śivaṃ tathā devīṃ nivedyāṃ * ca bhakṣayet || 56 ||,1665
kevalaṃ śivarūpohamityātmānaṃ vibhāvayet |<br/>jīvaḥ śivaḥ śivo jīvaḥ sa jīvaḥ kevalaḥ śivaḥ || 57 ||,1666
